Name,Organization,Rating,Level,Duration
Functional Programming in Scala Capstone,École Polytechnique Fédérale de Lausanne,4.4,Mixed,12
"Performing Network, Path, and Text Analyses in SAS Visual Analytics",SAS,4.7,Intermediate,4
Measuring Total Data Quality,University of Michigan,4.4733898305084745,Beginner,4
"The DMAIC Framework: Analyze, Improve, and Control Phase",SkillUp EdTech,4.4733898305084745,Beginner,12
ChatGPT Teach-Out,University of Michigan,4.5,Mixed,4
Using Data for Geographic Mapping and Forecasting in SAS Visual Analytics,SAS,4.8,Intermediate,4
Data Visualization Capstone,Johns Hopkins University,5.0,Mixed,4
Machine Learning Implementation and Operations in AWS,Whizlabs,4.4733898305084745,Beginner,4
Generative AI's Applications in Marketing Analytics,Edureka,4.4733898305084745,Beginner,4
Recommender Systems Capstone,University of Minnesota,4.1,Mixed,4
مشاركة البيانات من خلال فن مؤثرات عرض التصور,Google,4.6,Beginner,4
Data Science Companion,MathWorks,5.0,Beginner,4
Association Rules Analysis,University of Colorado Boulder,4.4733898305084745,Intermediate,12
Leadership and Team Management,SkillUp EdTech,4.4733898305084745,Intermediate,4
Dealing With Missing Data,"University of Maryland, College Park",3.8,Mixed,12
Serverless Data Processing with Dataflow: Operations,Google Cloud,3.6,Advanced,12
مشروع كابستون لشهادة تحليلات البيانات من Google: الانتهاء من دراسة الحالة,Google,4.9,Beginner,4
Intro to Lean Six Sigma and Project Identification Methods,SkillUp EdTech,4.4733898305084745,Beginner,4
Capstone Project: Predicting Safety Stock,LearnQuest,4.4733898305084745,Intermediate,4
Recommender Systems,Sungkyunkwan University,4.4733898305084745,Intermediate,4
"Building a Large-Scale, Automated Forecasting System",SAS,4.4733898305084745,Intermediate,12
Machine Learning for Marketers,University of Colorado System,4.4733898305084745,Intermediate,4
Capstone: Analyzing (Social) Network Data,University of California San Diego,4.7,Mixed,12
Data Mining for Smart Cities,IIT Roorkee,4.4733898305084745,Beginner,12
Data Collection and Root Cause Analysis,SkillUp EdTech,4.4733898305084745,Beginner,4
Hands-on Text Mining and Analytics,Yonsei University,3.9,Intermediate,12
Optimizing Machine Learning Performance,Alberta Machine Intelligence Institute,4.4,Mixed,4
The Fundamental of Data-Driven Investment,Sungkyunkwan University,4.4,Beginner,4
Dark Data Basics - Understanding the Unknown,Arizona State University,4.4733898305084745,Beginner,12
Regression Modeling for Marketers,University of Colorado System,4.4733898305084745,Intermediate,4
Visualizing & Communicating Results in Python with Jupyter,Codio,4.4733898305084745,Beginner,12
Combining and Analyzing Complex Data,"University of Maryland, College Park",4.1,Mixed,4
Causal Inference  2,Columbia University,3.4,Advanced,12
Reproducible Templates for Analysis and Dissemination,Emory University,4.7,Beginner,12
R البرمجة باستخدام لغة,Johns Hopkins University,4.4733898305084745,Intermediate,4
Data Analysis and Interpretation Capstone,Wesleyan University,4.7,Mixed,4
Using SAS Viya REST APIs with Python and R,SAS,4.7,Mixed,12
مجموعة أدوات عالم البيانات,Johns Hopkins University,4.7,Mixed,4
Generative AI Teach-Out,University of Michigan,4.3,Mixed,4
Finding and Preparing for the Right Job,"University of California, Irvine",4.4733898305084745,Beginner,4
Data Analysis with Python Project,University of Colorado Boulder,4.4733898305084745,Intermediate,12
Determining AI Needs,Fred Hutchinson Cancer Center,4.4733898305084745,Intermediate,4
الشبكات العصبية والتعلم العميق,DeepLearning.AI,4.3,Intermediate,4
Foundations of mining non-structured medical data,EIT Digital ,3.8,Beginner,12
‏SQL لعلوم البيانات,"University of California, Davis",4.4733898305084745,Beginner,4
Design Strategies for Maximizing Total Data Quality,University of Michigan,4.4733898305084745,Beginner,4
Designing Engaging Dashboards for Healthcare Analytics,Northeastern University ,4.4733898305084745,Mixed,4
CASL Programming for Distributed Computing in SAS® Viya®,SAS,4.4733898305084745,Advanced,12
Use Tableau for your Data Science Workflow,Edureka,4.4733898305084745,Beginner,4
Value Creation with Dark Data,Arizona State University,4.4733898305084745,Beginner,4
Voice of Change: Communicate with Teams for GenAI Adoption,Microsoft,4.4733898305084745,Intermediate,12
Communicating Data Science Results,University of Washington,3.4,Mixed,4
مقدمة عن البيانات الضخمة,University of California San Diego,4.5,Mixed,12
Cohere - An Introduction,Board Infinity ,4.4733898305084745,Intermediate,4
Data Mining Project,University of Illinois at Urbana-Champaign,4.5,Mixed,12
Four Rare Machine Learning Skills All Data Scientists Need,SAS,4.4733898305084745,Advanced,4
الحصول على البيانات وتنظيفها,Johns Hopkins University,4.4733898305084745,Mixed,4
تحليل البيانات الاستكشافية,Johns Hopkins University,4.4733898305084745,Mixed,4
Six Sigma for Process Improvement,SkillUp EdTech,4.4733898305084745,Intermediate,4
Meaningful Predictive Modeling,University of California San Diego,4.3,Intermediate,4
Preparing for the SAS® Viya® Programming Certification Exam,SAS,4.4733898305084745,Advanced,4
Extracting Value from Dark Data: ULEADD,Arizona State University,4.4733898305084745,Beginner,4
مقاييس الأعمال للشركات التي تعتمد على البيانات,Duke University,4.7,Mixed,12
Visualizing Data & Communicating Results in R with RStudio,Codio,4.4733898305084745,Beginner,12
Data science perspectives on pandemic management,Politecnico di Milano,4.4733898305084745,Beginner,12
Linear Algebra Basics,IIT Roorkee,4.4733898305084745,Intermediate,12
Advanced Reproducibility in Cancer Informatics,Johns Hopkins University,4.4733898305084745,Advanced,12
"Understanding China, 1700-2000: A Data Analytic Approach, Part 2",The Hong Kong University of Science and Technology,4.5,Mixed,4
Tools and Practices for Addressing Pandemic Challenges,Politecnico di Milano,4.4733898305084745,Beginner,12
تعزيز الشبكات العصبية : ضبط وتحسين مقياس فرط المعلمات,DeepLearning.AI,4.4733898305084745,Beginner,4
Machine Learning in the Enterprise - Português Brasileiro,Google Cloud,4.4733898305084745,Intermediate,12
Improvement Techniques and Control Tools,SkillUp EdTech,4.4733898305084745,Beginner,12
Leveraging Unstructured Data with Cloud Dataproc on Google Cloud em Português Brasileiro,Google Cloud,4.6,Intermediate,4
هيكلة مشاريع التعلم الآلي,DeepLearning.AI,4.4733898305084745,Beginner,4
Machine Learning Operations (MLOps): Getting Started - Português Brasileiro,Google Cloud,4.4733898305084745,Intermediate,4
Documentation and Usability for Cancer Informatics,Johns Hopkins University,4.4733898305084745,Intermediate,12
Data Science at Scale - Capstone Project,University of Washington,3.8,Mixed,12
الشبكات العصبونية الالتفافية,DeepLearning.AI,4.4733898305084745,Intermediate,4
النماذج المتعاقبة,DeepLearning.AI,4.4733898305084745,Intermediate,4
Advanced Statistical Analysis and Tools,SkillUp EdTech,4.4733898305084745,Intermediate,4
Getting Started with Amazon Personalize,Amazon Web Services,4.4733898305084745,Beginner,4
PostgreSQL Fundamentals: SQL Command Line,Amazon Web Services,4.4733898305084745,Beginner,4
PostgreSQL Fundamentals: Explain,Amazon Web Services,4.4733898305084745,Beginner,4
Introduction to Microsoft 365 Copilot,Microsoft,4.4733898305084745,Beginner,12
Database Design and Operational Business Intelligence,Edureka,4.4733898305084745,Intermediate,4
Advanced Microsoft Power BI,Edureka,4.4733898305084745,Advanced,4
