Name,Organization,Rating,Level,Duration
"Understanding China, 1700-2000: A Data Analytic Approach, Part 1",The Hong Kong University of Science and Technology,4.6,Mixed,12
Data intelligence for businesses and managers,Institut Mines-Télécom,4.4733898305084745,Beginner,12
أساسيات مايكروسوفت آوتلوك | Microsoft Outlook Fundamentals,Alfaisal University | KLD,4.8,Beginner,4
Landing.AI for Beginners: Build Data Visualization AI Models,Coursera Project Network,4.4733898305084745,Beginner,4
Healthcare Information Design and Visualizations,Northeastern University ,4.4733898305084745,Beginner,4
Interprofessional Healthcare Informatics,University of Minnesota,4.5,Mixed,12
Introduction to Recommender Systems:  Non-Personalized and Content-Based,University of Minnesota,4.4,Intermediate,12
Exploratory Data Analysis for the Public Sector with ggplot,University of Michigan,5.0,Intermediate,4
Improving Your Statistical Questions,Eindhoven University of Technology,4.9,Intermediate,12
Practical Machine Learning,Johns Hopkins University,4.5,Mixed,4
Data Science as a Field,University of Colorado Boulder,4.3,Intermediate,4
Deep Learning for Object Detection,MathWorks,4.4733898305084745,Intermediate,4
Sourcing Analytics,Rutgers the State University of New Jersey,4.4733898305084745,Beginner,4
The Role of the CEO in Navigating GenAI,Coursera ,5.0,Beginner,4
Machine Learning: Regression,University of Washington,4.8,Mixed,12
Developing Data Products,Johns Hopkins University,4.6,Mixed,12
AI Workflow: Business Priorities and Data Ingestion,IBM ,4.3,Intermediate,4
AI Workflow: AI in Production,IBM ,4.4,Advanced,4
AI Workflow: Data Analysis and Hypothesis Testing,IBM ,4.2,Advanced,4
AI Workflow: Feature Engineering and Bias Detection,IBM ,4.3,Advanced,4
Intro to AI Engineering,Scrimba,4.3,Intermediate,4
Making Data Science Work for Clinical Reporting,Genentech,4.4733898305084745,Intermediate,12
Data Science Fundamentals for Data Analysts,Databricks,4.2,Intermediate,12
ML Pipelines on Google Cloud,Google Cloud,3.5,Advanced,12
Statistical Analysis Fundamentals using Excel,IBM,4.4733898305084745,Intermediate,12
Advanced Deep Learning Methods for Healthcare,University of Illinois at Urbana-Champaign,2.5,Advanced,4
Introduction to Clinical Data Science,University of Colorado System,4.5,Intermediate,4
Data Processing and Feature Engineering with MATLAB,MathWorks,4.7,Intermediate,12
Data Storage in Microsoft Azure for Associate Developers,Microsoft,4.5,Intermediate,12
Practicing for the SAS Programming Certification Exam,SAS,4.8,Intermediate,4
Predictive Modeling and Machine Learning with MATLAB,MathWorks,4.8,Intermediate,4
Learn Embeddings and Vector Databases,Scrimba,4.4733898305084745,Intermediate,4
The R Programming Environment,Johns Hopkins University,4.3,Intermediate,12
Data Engineering in AWS,Whizlabs,3.4,Beginner,4
Applied Social Network Analysis in Python,University of Michigan,4.6,Intermediate,4
"Statistics and Data Analysis with Excel, Part 1",University of Colorado Boulder,4.4733898305084745,Beginner,12
Data Science Capstone,Johns Hopkins University,4.5,Mixed,12
Mathematical Biostatistics Boot Camp 2,Johns Hopkins University,4.3,Mixed,4
Regression and Classification,University of Colorado Boulder,3.5,Intermediate,12
Data Storytelling,"University of California, Irvine",3.7,Mixed,4
Probabilistic Graphical Models 3: Learning,Stanford University,4.6,Advanced,12
Serverless Data Processing with Dataflow: Foundations,Google Cloud,4.2,Intermediate,12
Serverless Data Processing with Dataflow: Develop Pipelines,Google Cloud,4.1,Advanced,12
Data Visualization Best Practices,"University of California, Irvine",3.9,Mixed,4
"Data – What It Is, What We Can Do With It",Johns Hopkins University,4.6,Beginner,4
Population Health: Predictive Analytics,Universiteit Leiden,4.6,Intermediate,12
Introduction to Data Visualization in Qlik Sense,Coursera Instructor Network,4.4733898305084745,Beginner,4
Introduction to Deep Learning,University of Colorado Boulder,3.6,Intermediate,12
Clinical Data Models and Data Quality Assessments,University of Colorado System,4.2,Intermediate,12
Big Data Integration and Processing,University of California San Diego,4.4,Beginner,12
Recommendation Systems on Google Cloud,Google Cloud,4.5,Advanced,12
Feature Engineering,Google Cloud,4.5,Intermediate,12
"Response Surfaces, Mixtures, and Model Building",Arizona State University,4.7,Intermediate,4
"Random Models, Nested and Split-plot Designs",Arizona State University,4.6,Intermediate,4
Principles of fMRI 2,Johns Hopkins University,4.7,Mixed,4
Introduction to Neurohacking In R,Johns Hopkins University,4.6,Intermediate,4
Follow a Machine Learning Workflow,CertNexus,4.6,Intermediate,12
Machine Learning Algorithms: Supervised Learning Tip to Tail,Alberta Machine Intelligence Institute,4.7,Mixed,4
Introduction to the Tidyverse,Johns Hopkins University,4.3,Beginner,12
"Extract, Transform, and Load Data",CertNexus,4.8,Intermediate,4
Scalable Machine Learning on Big Data using Apache Spark,IBM,3.8,Intermediate,4
Doing Clinical Research: Biostatistics with the Wolfram Language,University of Cape Town,4.7,Beginner,4
Getting started with TensorFlow 2,Imperial College London,4.9,Intermediate,12
Introduction to Vertex AI,Fractal Analytics,4.4733898305084745,Beginner,4
Model Diagnostics and Remedial Measures,Illinois Tech,4.4733898305084745,Intermediate,4
AI Workflow: Enterprise Model Deployment,IBM ,4.2,Advanced,4
Global Statistics - Composite Indices for International Comparisons,University of Geneva,4.6,Intermediate,12
Promote the Ethical Use of Data-Driven Technologies,CertNexus,4.7,Beginner,12
Advanced Deep Learning Techniques for Computer Vision,MathWorks,4.4733898305084745,Intermediate,4
Business Analytics for Decision Making,University of Colorado Boulder,4.6,Beginner,4
Factorial and Fractional Factorial Designs,Arizona State University,4.7,Intermediate,4
Moneyball and Beyond,University of Michigan,4.6,Intermediate,12
Introduction to Machine Learning in Sports Analytics,University of Michigan,4.6,Intermediate,4
ANOVA and Experimental Design,University of Colorado Boulder,3.9,Intermediate,4
Insights of Power BI,Fractal Analytics,4.4,Beginner,4
Data Mining Pipeline,University of Colorado Boulder,3.3,Intermediate,4
Stability and Capability in Quality Improvement,University of Colorado Boulder,4.6,Intermediate,12
Supervised Text Classification for Marketing Analytics,University of Colorado Boulder,3.4,Beginner,4
Measurement Systems Analysis,University of Colorado Boulder,4.3,Intermediate,12
Computational Social Science Methods,"University of California, Davis",4.7,Beginner,4
Predictive Modeling and Analytics,University of Colorado Boulder,3.6,Intermediate,4
Information Visualization: Applied Perception,New York University,4.7,Beginner,4
Machine Learning in the Enterprise,Google Cloud,4.6,Intermediate,12
Bayesian Statistics: Capstone Project,"University of California, Santa Cruz",4.4733898305084745,Advanced,4
Basic Programming in Python I,Northeastern University ,4.4733898305084745,Beginner,12
Basic Programming in Python II,Northeastern University ,4.4733898305084745,Beginner,4
"Virtualization, Docker, and Kubernetes for Data Engineering",Duke University,3.4,Advanced,4
Data Visualization in R with ggplot2,Johns Hopkins University,4.9,Intermediate,4
Empowering and Transforming Your Organization with GenAI,Coursera ,4.4733898305084745,Beginner,4
Navigating Generative AI Risks for Leaders,Coursera ,4.4733898305084745,Beginner,4
Data mining of Clinical Databases - CDSS 1,University of Glasgow ,4.8,Intermediate,4
Computer Vision Fundamentals with Google Cloud,Google Cloud,4.6,Advanced,12
Data Visualization with Tableau,Board Infinity ,4.4733898305084745,Beginner,4
Data Analysis Using SQL,Fractal Analytics,4.8,Beginner,12
Data Science in Real Life,Johns Hopkins University,4.5,Mixed,4
Turn Ethical Frameworks into Actionable Steps,CertNexus,4.6,Beginner,12
Explainable deep learning models for healthcare - CDSS 3,University of Glasgow ,4.8,Intermediate,4
"Build Decision Trees, SVMs, and Artificial Neural Networks",CertNexus,4.9,Intermediate,12
"Build Regression, Classification, and Clustering Models",CertNexus,4.2,Intermediate,12
Managing Machine Learning Projects with Google Cloud,Google Cloud,4.6,Beginner,12
Introduction to Applied Machine Learning,Alberta Machine Intelligence Institute,4.7,Intermediate,4
Data for Machine Learning,Alberta Machine Intelligence Institute,4.4,Intermediate,4
Wrangling Data in the Tidyverse,Johns Hopkins University,4.5,Mixed,12
Advanced R Programming,Johns Hopkins University,4.2,Intermediate,12
Data Management and Visualization,Wesleyan University,4.4,Mixed,12
Foundations for Big Data Analysis with SQL,Cloudera,4.8,Beginner,12
Wearable Technologies and Sports Analytics,University of Michigan,4.6,Intermediate,12
Linear Algebra: Orthogonality and Diagonalization,Johns Hopkins University,4.9,Intermediate,4
Machine Learning: Clustering & Retrieval,University of Washington,4.7,Mixed,12
Machine Learning for Computer Vision,MathWorks,4.9,Intermediate,4
Social Network Analysis,"University of California, Davis",4.7,Beginner,12
Customising your models with TensorFlow 2,Imperial College London,4.8,Intermediate,12
Linear Regression for Business Statistics,Rice University,4.8,Mixed,4
Advanced Data Visualization with R,Johns Hopkins University,4.9,Mixed,4
Scripting with Python and SQL for Data Engineering,Duke University,4.4,Intermediate,4
Structured Approach to Problem Solving,Fractal Analytics,4.8,Beginner,4
Python for Data Science,Fractal Analytics,3.9,Beginner,12
Graph Analytics for Big Data,University of California San Diego,4.3,Mixed,12
Data Visualization with Python,Duke University,3.8,Intermediate,4
Arranging and Visualizing Data in R,University of Michigan,4.4733898305084745,Intermediate,4
Analyzing Big Data with SQL,Cloudera,4.8,Beginner,12
Linear Regression Modeling for Health Data,University of Michigan,4.4733898305084745,Intermediate,4
Logistic Regression and Prediction for Health Data,University of Michigan,4.4733898305084745,Intermediate,4
Dashboarding and Deployment,"University of California, Irvine",5.0,Mixed,4
Regression Modeling Fundamentals,SAS,4.7,Intermediate,12
Overview: Six Sigma and the Organization,SkillUp EdTech,4.4733898305084745,Beginner,4
The DMAIC Framework - Define and Measure Phase,SkillUp EdTech,4.4733898305084745,Beginner,12
"The Power of Machine Learning: Boost Business, Accumulate Clicks, Fight Fraud, and Deny Deadbeats",SAS,4.8,Beginner,12
Launching Machine Learning: Delivering Operational Success with Gold Standard ML Leadership,SAS,4.8,Beginner,4
Data Analysis and Reporting in SAS Visual Analytics,SAS,4.8,Mixed,4
Health Data Science Foundation,University of Illinois at Urbana-Champaign,2.9,Advanced,4
"AI Workflow: Machine Learning, Visual Recognition and NLP",IBM ,4.5,Advanced,4
Basic Data Processing and Visualization,University of California San Diego,4.3,Intermediate,12
Advanced Data Analysis and Collaboration in Qlik Sense,Coursera Instructor Network,4.4733898305084745,Advanced,4
Publishing Visualizations in R with Shiny and flexdashboard,Johns Hopkins University,4.9,Mixed,4
طرح الأسئلة لاتخاذ قرارات قائمة على البيانات,Google,4.9,Beginner,4
Information Visualization: Advanced Techniques,New York University,4.8,Intermediate,4
Machine Learning: Concepts and Applications,The University of Chicago,3.3,Intermediate,12
Advanced AI Techniques for the Supply Chain,LearnQuest,3.4,Intermediate,4
Data Manipulation at Scale: Systems and Algorithms,University of Washington,4.3,Mixed,12
Introduction to Reproducibility in Cancer Informatics,Johns Hopkins University,4.4733898305084745,Intermediate,12
Measurement – Turning Concepts into Data,Johns Hopkins University,4.8,Beginner,4
Demand Forecasting Using Time Series,LearnQuest,3.3,Intermediate,4
Introduction to Bayesian Statistics,Databricks,3.6,Beginner,4
"Intro to Analytic Thinking, Data Science, and Data Mining","University of California, Irvine",4.2,Intermediate,4
Probabilistic Deep Learning with TensorFlow 2,Imperial College London,4.7,Advanced,12
Introduction to PyMC3 for Bayesian Modeling and Inference,Databricks,3.9,Beginner,4
Bayesian Inference with MCMC,Databricks,3.3,Beginner,4
Deep learning in Electronic Health Records - CDSS 2,University of Glasgow ,4.4733898305084745,Intermediate,4
Human Decision Making and its Biases,Fractal Analytics,5.0,Beginner,4
Machine Learning With Big Data,University of California San Diego,4.6,Mixed,12
Identifying Patient Populations,University of Colorado System,4.5,Intermediate,12
"Managing, Describing, and Analyzing Data",University of Colorado Boulder,4.6,Beginner,12
DataOps Methodology,IBM,4.7,Beginner,12
"Business Intelligence Concepts, Tools, and Applications",University of Colorado System,4.5,Mixed,12
Fundamental Tools of Data Wrangling,University of Colorado Boulder,4.7,Beginner,12
Building R Packages,Johns Hopkins University,4.1,Intermediate,4
Data Wrangling with Python Project,University of Colorado Boulder,4.4733898305084745,Intermediate,12
AWS: Security in Data Analytics,Whizlabs,4.4733898305084745,Beginner,4
Nearest Neighbor Collaborative Filtering,University of Minnesota,4.3,Mixed,12
Business Applications of Hypothesis Testing and Confidence Interval Estimation,Rice University,4.8,Mixed,4
Business Statistics and Analysis Capstone,Rice University,4.7,Mixed,4
Modeling Data in the Tidyverse,Johns Hopkins University,4.6,Mixed,12
Visualizing Data in the Tidyverse,Johns Hopkins University,4.7,Mixed,12
Importing Data in the Tidyverse,Johns Hopkins University,4.7,Beginner,12
Fundamentals of Data Analysis,LearnQuest,3.9,Beginner,12
Advanced Linear Models for Data Science 1: Least Squares,Johns Hopkins University,4.5,Advanced,12
Clinical Decision Support Systems - CDSS 4,University of Glasgow ,4.4733898305084745,Intermediate,4
Capstone Assignment - CDSS 5,University of Glasgow ,4.4733898305084745,Intermediate,4
Exploratory Data Analysis in AWS,Whizlabs,4.4733898305084745,Beginner,4
Introduction to Predictive Modeling,University of Minnesota,4.8,Mixed,4
Data Storytelling,Fractal Analytics,4.9,Beginner,4
Foundations of Machine Learning,Fractal Analytics,5.0,Beginner,12
Communicate Effectively about Ethical Challenges in Data-Driven Technologies,CertNexus,4.4,Beginner,12
Detect and Mitigate Ethical Risks,CertNexus,4.5,Beginner,12
Create and Lead an Ethical Data-Driven Organization,CertNexus,4.6,Beginner,12
Framework for Data Collection and Analysis,"University of Maryland, College Park",4.2,Intermediate,4
Bayesian Statistics,Duke University,3.8,Intermediate,12
Communicating Business Analytics Results,University of Colorado Boulder,4.5,Intermediate,4
Recommender Systems:  Evaluation and Metrics,University of Minnesota,4.4,Mixed,12
Advanced Business Analytics Capstone,University of Colorado Boulder,4.3,Intermediate,4
Julia Scientific Programming,University of Cape Town,4.4,Beginner,4
New Ways of Working in an AI World,London Business School,4.4733898305084745,Intermediate,12
Quantifying Relationships with Regression Models,Johns Hopkins University,4.6,Intermediate,4
Advanced Clinical Data Science,University of Colorado System,4.8,Intermediate,4
Cluster Analysis in Data Mining,University of Illinois at Urbana-Champaign,4.5,Mixed,12
Pattern Discovery in Data Mining,University of Illinois at Urbana-Champaign,4.3,Mixed,12
Case studies in business analytics with ACCENTURE,ESSEC Business School,3.7,Mixed,4
Deep Learning Methods for Healthcare,University of Illinois at Urbana-Champaign,3.7,Advanced,4
Increasing Real Estate Management Profits: Harnessing Data Analytics,Duke University,4.7,Mixed,12
Clinical Natural Language Processing,University of Colorado System,3.6,Intermediate,12
Advanced Machine Learning Algorithms,Fractal Analytics,4.4733898305084745,Beginner,12
Computer Simulations,"University of California, Davis",4.5,Beginner,4
AI-Driven Attribution Testing,Board Infinity ,4.4733898305084745,Intermediate,4
Neural Networks and Random Forests,LearnQuest,2.9,Intermediate,4
تجهيز البيانات للاستكشاف,Google,4.9,Beginner,12
معالجة البيانات من غير نظيفة إلى نظيفة,Google,4.9,Beginner,12
تحليل البيانات باستخدام البرمجة R,Google,4.5,Beginner,12
Leveraging Virtual Assistants for Personal Productivity,Coursera Instructor Network,4.5,Beginner,4
Fundamentals of Machine Learning for Supply Chain,LearnQuest,3.8,Beginner,4
Data Literacy Essentials,SAS,4.4733898305084745,Beginner,4
Optimization for Decision Making,University of Minnesota,4.8,Beginner,4
Nursing Informatics Leadership Theory and Practice,University of Minnesota,4.7,Beginner,12
Hypothesis Testing with Python and Excel,Tufts University,4.1,Intermediate,4
Mastering Software Development in R Capstone,Johns Hopkins University,4.0,Intermediate,12
Computational Social Science Capstone Project,"University of California, Davis",4.6,Intermediate,4
Data Analysis in R with RStudio & Tidyverse,Codio,4.3,Beginner,12
Managing Big Data in Clusters and Cloud Storage,Cloudera,4.7,Beginner,12
Identifying the Right Role for Yourself,"University of California, Irvine",4.4733898305084745,Beginner,4
The Total Data Quality Framework,University of Michigan,4.5,Beginner,4
SAS® Programming for Distributed Computing in SAS® Viya®,SAS,4.9,Advanced,12
"Interviewing, Negotiating a Job Offer, and Career Planning","University of California, Irvine",4.4733898305084745,Beginner,4
Databricks to Local LLMs,Duke University,4.4733898305084745,Beginner,4
Artificial Intelligence Algorithms Models and Limitations,LearnQuest,4.7,Beginner,4
Data Analyst Career Guide and Interview Preparation,IBM,4.6,Beginner,4
Artificial Intelligence Ethics in Action,LearnQuest,4.6,Intermediate,4
"Cluster Analysis, Association Mining, and Model Evaluation","University of California, Irvine",4.5,Intermediate,4
Fundamentals of Data Visualization,University of Colorado Boulder,4.7,Intermediate,4
Relational database systems,Universidad Nacional Autónoma de México,4.4,Intermediate,12
Data Mining Methods,University of Colorado Boulder,3.9,Intermediate,4
Unsupervised Algorithms in Machine Learning,University of Colorado Boulder,3.9,Intermediate,4
Predictive Modeling with Logistic Regression using SAS,SAS,4.6,Intermediate,12
Enjoyable Econometrics,Erasmus University Rotterdam,4.1,Beginner,12
Ethical Issues in Data Science,University of Colorado Boulder,4.6,Beginner,12
Amazon Bedrock - Getting Started with Generative AI,Amazon Web Services,4.4,Beginner,4
Planning a Generative AI Project,Amazon Web Services,4.7,Mixed,4
Data Mining Project,University of Colorado Boulder,4.3,Intermediate,4
NoSQL systems,Universidad Nacional Autónoma de México,4.3,Intermediate,12
Big Data - Capstone Project,University of California San Diego,4.4,Mixed,12
Artificial Intelligence Privacy and Convenience,LearnQuest,4.7,Intermediate,4
Automated Report Generation with Generative AI,Coursera Instructor Network,4.4733898305084745,Beginner,4
Address Business Issues with Data Science,CertNexus,4.5,Intermediate,4
"Predictive Modeling, Model Fitting, and Regression Analysis","University of California, Irvine",4.4,Intermediate,4
Introduction to Data Science and scikit-learn in Python,LearnQuest,3.8,Beginner,4
Business intelligence and data warehousing,Universidad Nacional Autónoma de México,3.9,Intermediate,12
Data Analysis Tools,Wesleyan University,4.5,Mixed,4
Design and Build a Data Warehouse for Business Intelligence Implementation,University of Colorado System,4.6,Mixed,12
Data Analysis in Python with pandas & matplotlib in Spyder,Codio,3.1,Beginner,12
Exploratory Data Analysis,University of Leeds,4.4733898305084745,Intermediate,4
Advanced Models for Decision Making,University of Minnesota,4.8,Beginner,4
Amazon CodeWhisperer - Getting Started with Generative AI,Amazon Web Services,4.3,Beginner,4
Visualization for Data Journalism,University of Illinois at Urbana-Champaign,4.5,Beginner,12
Data Preparation and Analysis,Illinois Tech,4.4733898305084745,Intermediate,12
Analyze Data,CertNexus,4.7,Intermediate,12
Simulation Models for Decision Making,University of Minnesota,4.6,Beginner,4
Machine Learning for Data Analysis,Wesleyan University,4.2,Mixed,4
Relational Database Support for Data Warehouses,University of Colorado System,4.6,Mixed,12
Data Analysis with Tidyverse,University of Colorado Boulder,4.4733898305084745,Beginner,12
Building a Generative AI-Ready Organization,Amazon Web Services,4.1,Beginner,4
Regression Modeling in Practice,Wesleyan University,4.4,Mixed,4
Web of Data,EIT Digital ,4.1,Intermediate,4
R Programming and Tidyverse Capstone Project,University of Colorado Boulder,4.4733898305084745,Beginner,4
Train Machine Learning Models,CertNexus,4.4733898305084745,Intermediate,12
Designing data-intensive applications,Universidad Nacional Autónoma de México,4.4,Intermediate,4
Data Visualization,Ball State University,4.4733898305084745,Intermediate,12
Basic Recommender Systems,EIT Digital ,4.3,Intermediate,4
"Variable Selection, Model Validation, Nonlinear Regression",Illinois Tech,4.4733898305084745,Intermediate,4
Design Thinking for Data Professionals,Fractal Analytics,4.4733898305084745,Intermediate,12
Relational Database Implementation and Applications,Illinois Tech,4.4733898305084745,Intermediate,12
"Defining, Describing, and Visualizing Data",University of Colorado Boulder,4.4733898305084745,Beginner,12
Capstone Project: Advanced AI for Drug Discovery,LearnQuest,1.9,Intermediate,4
Machine Learning Using SAS Viya,SAS,4.7,Intermediate,12
"Resampling, Selection and Splines",University of Colorado Boulder,4.4733898305084745,Intermediate,12
Machine Learning Models in Science,LearnQuest,3.8,Intermediate,4
AWS: Data Collection Systems,Whizlabs,4.8,Beginner,4
Classification Analysis,University of Colorado Boulder,4.4733898305084745,Intermediate,12
Unsupervised Text Classification for Marketing Analytics,University of Colorado Boulder,4.4733898305084745,Intermediate,12
Customer Data Analytics for Marketers,University of Colorado System,4.4733898305084745,Intermediate,4
AI-Enhanced Presentations Captivating Audiences with TOME,Coursera Instructor Network,4.4733898305084745,Beginner,4
"Trees, SVM and Unsupervised Learning",University of Colorado Boulder,4.4733898305084745,Intermediate,4
Finalize a Data Science Project,CertNexus,4.4733898305084745,Intermediate,4
"Data Ingestion, Exploration & Visualization in Qlik Sense",Coursera Instructor Network,4.4733898305084745,Intermediate,4
Network Analysis for Marketing Analytics,University of Colorado Boulder,4.4733898305084745,Intermediate,4
تحليل البيانات للإجابة عن الأسئلة,Google,4.7,Beginner,4
User Awareness and Education for Generative AI,Coursera Instructor Network,4.4733898305084745,Beginner,4
Advanced Linear Models for Data Science 2: Statistical Linear Models,Johns Hopkins University,4.5,Advanced,4
Population Health: Responsible Data Analysis,Universiteit Leiden,4.5,Beginner,12
Natural Language Processing and Capstone Assignment,"University of California, Irvine",4.6,Intermediate,4
Creating Features for Time Series Data,SAS,4.4733898305084745,Intermediate,12
Build a Data Warehouse Using BigQuery,Starweaver,4.4733898305084745,Advanced,4
Design Thinking and Predictive Analytics for Data Products,University of California San Diego,4.5,Intermediate,12
AWS: Data Analysis and Visualization,Whizlabs,4.4733898305084745,Beginner,4
Public Engagement for Scientists,Illinois Tech,4.4733898305084745,Intermediate,12
Data Collection and Integration,University of Colorado Boulder,4.4733898305084745,Intermediate,12
Creating Advanced Reports with SAS Visual Analytics,SAS,4.7,Intermediate,4
"Machine Learning Under the Hood: The Technical Tips, Tricks, and Pitfalls",SAS,4.9,Beginner,4
The Rise of Generative AI,Board Infinity ,4.4733898305084745,Beginner,4
AI-Enhanced Content Creation:Elevate Copywriting with Humata,Coursera Instructor Network,4.4733898305084745,Beginner,4
"Data Acquisition, Risk, and Estimation",University of Colorado Boulder,4.4733898305084745,Intermediate,12
Modeling Time Series and Sequential Data,SAS,4.4733898305084745,Intermediate,12
Modeling in AWS,Whizlabs,4.4733898305084745,Beginner,4
LangChain: Application Development Essentials,Coursera Instructor Network,4.4733898305084745,Beginner,4
Data Science Project: MATLAB for the Real World,MathWorks,4.8,Intermediate,4
Data Driven Decision Making,University of Colorado Boulder,4.4733898305084745,Intermediate,12
Data Processing and Manipulation,University of Colorado Boulder,4.4733898305084745,Intermediate,4
Power BI for Data Science and Analytics,Edureka,4.4733898305084745,Intermediate,4
Building Data Visualization Tools,Johns Hopkins University,4.0,Intermediate,12
ML Algorithms,Whizlabs,4.4733898305084745,Beginner,4
Data Understanding and Visualization,University of Colorado Boulder,4.4733898305084745,Intermediate,4
Automation for Everyone: Tech Benefits Unleashed,Coursera Instructor Network,4.4733898305084745,Beginner,4
Matrix Factorization and Advanced Techniques,University of Minnesota,4.3,Mixed,12
3D Data Visualization for Science Communication,University of Illinois at Urbana-Champaign,4.4733898305084745,Beginner,12
Machine Teaching for Autonomous AI,University of Washington,4.8,Beginner,4
AWS Data Processing,Whizlabs,4.4733898305084745,Beginner,4
Clustering Analysis,University of Colorado Boulder,4.4733898305084745,Intermediate,12
Regression Analysis,University of Colorado Boulder,4.4733898305084745,Intermediate,12
Practical Predictive Analytics: Models and Methods,University of Washington,4.1,Mixed,4
Deploying Machine Learning Models,University of California San Diego,3.5,Mixed,12
Practical Machine Learning on H2O,H2O,4.5,Intermediate,12
Advanced Recommender Systems,EIT Digital ,3.7,Intermediate,12
Data Literacy in Practice,SAS,4.4733898305084745,Beginner,4
