Name,Organization,Rating,Level,Duration
"Foundations: Data, Data, Everywhere",Google,4.8,Beginner,12
Supervised Machine Learning: Regression and Classification,DeepLearning.AI,4.9,Beginner,4
Generative AI for Everyone,DeepLearning.AI,4.8,Beginner,4
Prompt Engineering for ChatGPT,Vanderbilt University,4.8,Beginner,12
Ask Questions to Make Data-Driven Decisions,Google,4.7,Beginner,4
Advanced Learning Algorithms,DeepLearning.AI,4.9,Beginner,4
Neural Networks and Deep Learning,DeepLearning.AI,4.9,Intermediate,4
"Python for Data Science, AI & Development",IBM,4.6,Beginner,12
Prepare Data for Exploration,Google,4.8,Beginner,12
What is Data Science?,IBM,4.7,Beginner,4
Introduction to Data Analytics,IBM,4.8,Beginner,12
Introduction to Statistics,Stanford University,4.6,Beginner,12
Introduction to Artificial Intelligence (AI),IBM,4.7,Beginner,4
Process Data from Dirty to Clean,Google,4.8,Beginner,12
"Unsupervised Learning, Recommenders, Reinforcement Learning",DeepLearning.AI,4.9,Beginner,4
Excel Basics for Data Analysis,IBM,4.8,Beginner,12
"Improving Deep Neural Networks: Hyperparameter Tuning, Regularization and Optimization",DeepLearning.AI,4.9,Intermediate,4
Analyze Data to Answer Questions,Google,4.6,Beginner,4
Tools for Data Science,IBM,4.5,Beginner,12
Generative AI: Introduction and Applications,IBM,4.6,Beginner,4
Data Analysis with R Programming,Google,4.8,Beginner,12
Introduction to Machine Learning in Production,DeepLearning.AI,4.8,Advanced,4
Databases and SQL for Data Science with Python,IBM,4.6,Beginner,12
Machine Learning with Python,IBM,4.7,Intermediate,12
Preparing  Data for Analysis with Microsoft Excel,Microsoft,4.7,Beginner,4
Foundations of Data Science,Google,4.7,Advanced,12
Share Data Through the Art of Visualization,Google,4.6,Beginner,4
Foundations of Business Intelligence,Google,4.7,Advanced,4
Generative AI: Prompt Engineering Basics,IBM,4.8,Beginner,4
Data Analysis with Python,IBM,4.7,Beginner,12
Convolutional Neural Networks,DeepLearning.AI,4.9,Intermediate,4
Sequence Models,DeepLearning.AI,4.8,Intermediate,4
Structuring Machine Learning Projects,DeepLearning.AI,4.8,Beginner,4
Google Data Analytics Capstone: Complete a Case Study,Google,4.8,Beginner,4
Natural Language Processing with Classification and Vector Spaces,DeepLearning.AI,4.6,Intermediate,4
Python Project for Data Science,IBM,4.5,Intermediate,4
Get Started with Python,Google,4.8,Advanced,12
Data Science Methodology,IBM,4.6,Beginner,4
Data Visualization and Dashboards with Excel and Cognos,IBM,4.7,Beginner,4
Machine Learning Data Lifecycle in Production,DeepLearning.AI,4.3,Advanced,4
SQL for Data Science,"University of California, Davis",4.6,Beginner,4
Harnessing the Power of Data with Power BI,Microsoft,4.5,Beginner,4
Trustworthy Generative AI,Vanderbilt University,4.8,Beginner,4
Data Visualization with Python,IBM,4.5,Intermediate,12
Machine Learning Foundations for Product Managers,Duke University,4.6,Beginner,12
The Path to Insights: Data Models and Pipelines,Google,4.7,Advanced,4
Exploratory Data Analysis for Machine Learning,IBM,4.6,Intermediate,12
Go Beyond the Numbers: Translate Data into Insights,Google,4.8,Advanced,12
Convolutional Neural Networks in TensorFlow,DeepLearning.AI,4.7,Intermediate,4
Natural Language Processing with Probabilistic Models,DeepLearning.AI,4.7,Intermediate,4
AI Strategy and Governance,University of Pennsylvania,4.8,Beginner,4
"Extract, Transform and Load Data in Power BI",Microsoft,4.5,Beginner,4
Introduction to Clinical Data,Stanford University,4.7,Beginner,12
Pre-MBA Statistics,IIMA - IIM Ahmedabad,4.5,Beginner,12
AI Applications in People Management,University of Pennsylvania,4.7,Mixed,4
Mathematics for Machine Learning: Linear Algebra,Imperial College London,4.7,Beginner,12
Data Analysis and Visualization with Power BI,Microsoft,4.7,Beginner,12
Introduction to Deep Learning & Neural Networks with Keras,IBM,4.7,Intermediate,12
Build Basic Generative Adversarial Networks (GANs),DeepLearning.AI,4.7,Intermediate,4
Natural Language Processing in TensorFlow,DeepLearning.AI,4.6,Intermediate,4
AI for Medical Diagnosis,DeepLearning.AI,4.7,Intermediate,4
Fundamentals of Machine Learning for Healthcare,Stanford University,4.8,Beginner,12
GPT Vision: Seeing the World through Generative AI,Vanderbilt University,4.7,Beginner,4
Machine Learning Modeling Pipelines in Production,DeepLearning.AI,4.4,Advanced,12
Introduction to Computer Vision and Image Processing,IBM,4.3,Beginner,12
"Sequences, Time Series and Prediction",DeepLearning.AI,4.7,Intermediate,4
Fundamentals of Reinforcement Learning,University of Alberta,4.8,Intermediate,12
Data Modeling in Power BI,Microsoft,4.2,Beginner,4
Navigating Generative AI: A CEO Playbook,Coursera ,4.7,Mixed,4
Applied Data Science Capstone,IBM,4.7,Intermediate,12
Deep Neural Networks with PyTorch,IBM,4.4,Intermediate,12
Natural Language Processing with Attention Models,DeepLearning.AI,4.4,Intermediate,4
The Power of Statistics,Google,4.8,Advanced,12
Deploying Machine Learning Models in Production,DeepLearning.AI,4.5,Advanced,4
Supply Chain Management and Analytics,Unilever,4.7,Beginner,12
Natural Language Processing with Sequence Models,DeepLearning.AI,4.5,Intermediate,4
Evaluations of AI Applications in Healthcare,Stanford University,4.6,Beginner,12
"Decisions, Decisions: Dashboards and Reports",Google,4.8,Advanced,12
Google Cloud Big Data and Machine Learning Fundamentals,Google Cloud,4.7,Beginner,12
Regression Analysis: Simplify Complex Data Relationships,Google,4.7,Advanced,12
AI and Public Health,DeepLearning.AI,4.7,Beginner,4
Introduction to Machine Learning,Duke University,4.7,Intermediate,12
Introduction to Probability and Data with R,Duke University,4.7,Beginner,12
Generative AI Essentials: Overview and Impact,University of Michigan,4.7,Beginner,4
Building AI Applications with Watson APIs,IBM,4.3,Intermediate,12
IBM Data Analyst Capstone Project,IBM,4.6,Intermediate,12
Data-driven Decision Making,PwC,4.6,Beginner,4
R Programming,Johns Hopkins University,4.5,Intermediate,4
The Nuts and Bolts of Machine Learning,Google,4.8,Advanced,12
Microsoft PL-300 Exam Preparation and Practice,Microsoft,4.5,Beginner,12
Introduction to Data Science in Python,University of Michigan,4.5,Intermediate,4
Build Better Generative Adversarial Networks (GANs),DeepLearning.AI,4.7,Intermediate,4
Fundamentals of Visualization with Tableau,"University of California, Davis",4.5,Beginner,4
Supervised Machine Learning: Regression,IBM,4.7,Intermediate,12
Computational Neuroscience,University of Washington,4.6,Beginner,12
Google Advanced Data Analytics Capstone,Google,4.9,Advanced,4
Foundations of Data Science: K-Means Clustering in Python,University of London,4.6,Beginner,12
"Introduction to Trading, Machine Learning & GCP",Google Cloud,4.0,Intermediate,4
"Capstone: Retrieving, Processing, and Visualizing Data with Python",University of Michigan,4.7,Beginner,12
Managing Machine Learning Projects,Duke University,4.8,Beginner,12
Creative Designing in Power BI,Microsoft,4.4,Beginner,4
Getting Started with SAS Programming,SAS,4.8,Beginner,12
Problem Solving with Excel,PwC,4.7,Beginner,4
Building Deep Learning Models with TensorFlow,IBM,4.4,Intermediate,12
Probabilistic Graphical Models 1: Representation,Stanford University,4.6,Advanced,12
Sample-based Learning Methods,University of Alberta,4.8,Intermediate,12
Introduction to Genomic Technologies,Johns Hopkins University,4.6,Mixed,4
The Structured Query Language (SQL),University of Colorado Boulder,4.7,Beginner,12
Bayesian Statistics: From Concept to Data Analysis,"University of California, Santa Cruz",4.6,Intermediate,4
Introduction to Embedded Machine Learning,Edge Impulse,4.8,Intermediate,4
Deploy and Maintain Power BI Assets and Capstone project,Microsoft,4.3,Beginner,12
Data Analytics for Lean Six Sigma,University of Amsterdam,4.8,Beginner,12
Introduction to Business Analytics,Tableau Learning Partner,4.7,Beginner,4
Machine Learning Introduction for Everyone,IBM,4.5,Beginner,4
"Data Wrangling, Analysis and AB Testing with SQL","University of California, Davis",3.3,Intermediate,4
SQL: A Practical Introduction for Querying Databases,IBM,4.6,Beginner,12
Apply Generative Adversarial Networks (GANs),DeepLearning.AI,4.8,Intermediate,4
A Crash Course in Causality:  Inferring Causal Effects from Observational Data,University of Pennsylvania,4.7,Intermediate,12
Getting Started with Data Analytics on AWS,Amazon Web Services,4.5,Beginner,4
Supervised Machine Learning: Classification,IBM,4.8,Intermediate,12
Data Analysis Using Python,University of Pennsylvania,4.5,Beginner,4
The Data Scientist’s Toolbox,Johns Hopkins University,4.6,Mixed,4
AI and Climate Change,DeepLearning.AI,4.8,Beginner,4
Understanding and Visualizing Data with Python,University of Michigan,4.7,Beginner,4
AI Capstone Project with Deep Learning,IBM,4.5,Advanced,4
Process Mining: Data science in Action,Eindhoven University of Technology,4.7,Intermediate,12
Mathematics for Machine Learning: PCA,Imperial College London,4.0,Intermediate,4
Python for Genomic Data Science,Johns Hopkins University,4.3,Mixed,4
Microsoft Azure for Data Engineering,Microsoft,4.5,Intermediate,4
Assessment for Data Analysis and Visualization Foundations,IBM,4.6,Beginner,4
Introduction to R Programming for Data Science,IBM,4.5,Beginner,12
Deep Learning and Reinforcement Learning,IBM,4.6,Intermediate,12
AI for Medical Prognosis,DeepLearning.AI,4.7,Intermediate,4
Human Factors in AI,Duke University,4.7,Beginner,4
"Custom Models, Layers, and Loss Functions with TensorFlow",DeepLearning.AI,4.9,Intermediate,12
"Statistical Thinking for Industrial Problem Solving, presented by JMP",SAS,4.8,Beginner,12
Basic Statistics,University of Amsterdam,4.6,Beginner,12
Advanced Computer Vision with TensorFlow,DeepLearning.AI,4.8,Intermediate,4
Applied Machine Learning in Python,University of Michigan,4.6,Intermediate,4
"Data Ethics, AI and Responsible Innovation",The University of Edinburgh,4.4733898305084745,Intermediate,12
Leveraging AI for Enhanced Content Creation,Coursera Instructor Network,4.9,Beginner,4
Using Data Analytics in Supply Chain,Unilever,4.4733898305084745,Beginner,12
Introduction to Tableau,Tableau Learning Partner,4.8,Beginner,4
Probability Theory: Foundation for Data Science,University of Colorado Boulder,4.5,Intermediate,12
Social Media Data Analytics,University of Washington,4.1,Intermediate,4
AI For Medical Treatment,DeepLearning.AI,4.7,Intermediate,4
Analyzing and Visualizing Data in Looker,Google Cloud,4.7,Beginner,12
Generative AI: Foundation Models and Platforms,IBM,4.8,Beginner,4
Linear Algebra: Linear Systems and Matrix Equations,Johns Hopkins University,4.7,Beginner,4
Inferential Statistics,Duke University,4.8,Beginner,12
Machine Learning with Apache Spark,IBM,4.6,Intermediate,4
Econometrics: Methods and Applications,Erasmus University Rotterdam,4.6,Mixed,12
Using Machine Learning in Trading and Finance,New York Institute of Finance,3.9,Intermediate,12
Introduction to Designing Data Lakes on AWS,Amazon Web Services,4.7,Intermediate,4
Prediction and Control with Function Approximation,University of Alberta,4.8,Intermediate,12
Fundamental Skills in Bioinformatics,King Abdullah University of Science and Technology,4.6,Beginner,4
Unsupervised Machine Learning,IBM,4.7,Intermediate,12
A Complete Reinforcement Learning System (Capstone),University of Alberta,4.7,Intermediate,12
Generative AI: Enhance your Data Analytics Career,IBM,4.3,Intermediate,4
Rust Fundamentals,Duke University,4.2,Beginner,4
Data Visualization with Advanced Excel,PwC,4.8,Beginner,4
An Intuitive Introduction to Probability,University of Zurich,4.8,Beginner,12
Fundamentals of Scalable Data Science,IBM,4.3,Beginner,4
Business Analytics Capstone,University of Pennsylvania,4.5,Intermediate,12
Data Scientist Career Guide and Interview Preparation,IBM,4.8,Beginner,4
GenAI for Everyone,Fractal Analytics,4.2,Beginner,4
Custom and Distributed Training with TensorFlow,DeepLearning.AI,4.8,Intermediate,4
Doing Economics: Measuring Climate Change,University of London,4.5,Beginner,4
Data Analysis with R,IBM,4.7,Intermediate,12
Statistics for Data Science with Python,IBM,4.5,Mixed,12
Spatial Data Science and Applications,Yonsei University,4.4,Intermediate,12
Research Data Management and Sharing,The University of North Carolina at Chapel Hill,4.7,Mixed,12
SQL for Data Science with R,IBM,4.3,Beginner,12
Doing More with SAS Programming,SAS,4.8,Intermediate,12
Introduction to Relational Databases,Illinois Tech,4.3,Beginner,4
Applied Calculus with Python,Johns Hopkins University,4.8,Intermediate,12
Business Analysis Process,Tableau Learning Partner,4.6,Beginner,4
Advanced Machine Learning and Signal Processing,IBM,4.5,Advanced,4
Data Storage in Microsoft Azure,Microsoft,4.3,Intermediate,12
AI and Disaster Management,DeepLearning.AI,4.8,Beginner,4
Introduction to Data Analysis Using Excel,Rice University,4.7,Mixed,4
Experimental Design Basics,Arizona State University,4.7,Intermediate,12
Algorithms for DNA Sequencing,Johns Hopkins University,4.7,Mixed,4
Bayesian Statistics: Techniques and Models,"University of California, Santa Cruz",4.8,Intermediate,12
Supply Chain Software Tools,Unilever,4.4733898305084745,Beginner,4
Advanced Data Visualization with Tableau,Tableau Learning Partner,4.9,Beginner,4
Data Visualization with Tableau,Tableau Learning Partner,4.8,Beginner,12
Probabilistic Graphical Models 2: Inference,Stanford University,4.6,Advanced,12
Apache Spark (TM) SQL for Data Analysts,Databricks,4.5,Intermediate,12
Distributed Computing with Spark SQL,"University of California, Davis",4.5,Intermediate,4
"Generative AI: Impact, Considerations, and Ethical Issues",IBM,4.7,Beginner,4
Linear Regression and Modeling,Duke University,4.8,Beginner,4
Developing AI Applications on Azure,LearnQuest,4.4,Advanced,12
Business Metrics for Data-Driven Companies,Duke University,4.6,Mixed,12
Data Science Ethics,University of Michigan,4.7,Beginner,12
Machine Translation,Karlsruhe Institute of Technology,4.5,Intermediate,12
The Unix Workbench,Johns Hopkins University,4.7,Beginner,12
Experimentation for Improvement,McMaster University,4.8,Intermediate,12
Data Science in Health Technology Assessment,Genentech,4.4733898305084745,Intermediate,4
Computer Vision with Embedded Machine Learning,Edge Impulse,4.8,Intermediate,4
Data Integration with Microsoft Azure Data Factory,Microsoft,3.9,Intermediate,12
Implementing Supply Chain Analytics,Unilever,4.4733898305084745,Beginner,4
Generative AI: Business Transformation and Career Growth,IBM,4.7,Beginner,4
Data Visualization and Communication with Tableau,Duke University,4.7,Mixed,12
Command Line Tools for Genomic Data Science,Johns Hopkins University,4.0,Mixed,4
Visual Analytics with Tableau,"University of California, Davis",4.6,Beginner,4
Data Visualization,University of Illinois at Urbana-Champaign,4.5,Mixed,12
Getting and Cleaning Data,Johns Hopkins University,4.5,Mixed,4
A Crash Course in Data Science,Johns Hopkins University,4.5,Beginner,4
Artificial Intelligence for Breast Cancer Detection,Johns Hopkins University,4.6,Intermediate,4
Essential Design Principles for Tableau,"University of California, Davis",4.4,Beginner,4
Introduction to Python Fundamentals,University of Colorado Boulder,4.7,Beginner,4
Generative AI: Elevate Your Data Science Career,IBM,4.8,Intermediate,4
"Spark, Hadoop, and Snowflake for Data Engineering",Duke University,3.6,Advanced,4
Generative Deep Learning with TensorFlow,DeepLearning.AI,4.9,Intermediate,4
Production Machine Learning Systems,Google Cloud,4.6,Advanced,12
Responsible AI - Principles and Ethical Considerations,Fractal Analytics,4.0,Intermediate,12
Fundamentals of Data Analytics in the Public Sector with R,University of Michigan,4.7,Intermediate,12
"Applied Plotting, Charting & Data Representation in Python",University of Michigan,4.5,Intermediate,4
Specialized Models: Time Series and Survival Analysis,IBM,4.5,Intermediate,4
Microsoft Azure Databricks for Data Engineering,Microsoft,4.3,Intermediate,12
Managing Big Data with MySQL,Duke University,4.7,Mixed,12
Practical Time Series Analysis,The State University of New York,4.6,Intermediate,12
Data Ecosystem,Tableau Learning Partner,4.6,Beginner,4
"Foundations of Sports Analytics: Data, Representation, and Models in Sports",University of Michigan,4.4,Intermediate,12
Microsoft Azure Machine Learning,Microsoft,4.4,Beginner,4
Machine Learning Foundations: A Case Study Approach,University of Washington,4.6,Mixed,12
Data Engineering with Rust,Duke University,3.4,Intermediate,4
"Big Data, Artificial Intelligence, and Ethics","University of California, Davis",4.6,Beginner,4
"Linear Algebra: Matrix Algebra, Determinants, & Eigenvectors",Johns Hopkins University,4.8,Mixed,12
Guided Tour of Machine Learning in Finance,New York University,3.8,Intermediate,4
Inferential Statistics,University of Amsterdam,4.3,Mixed,12
Reinforcement Learning for Trading Strategies,New York Institute of Finance,3.6,Intermediate,4
Exploratory Data Analysis,Johns Hopkins University,4.7,Mixed,4
Applied AI with DeepLearning,IBM,4.4,Advanced,4
Getting Started with SAS Visual Analytics,SAS,4.7,Beginner,4
Foundations of Local Large Language models,Duke University,4.4733898305084745,Beginner,4
Improving your statistical inferences,Eindhoven University of Technology,4.9,Intermediate,12
MLOps Platforms: Amazon SageMaker and Azure ML,Duke University,3.8,Advanced,12
Data Visualization with R,IBM,4.6,Beginner,4
Principles of fMRI 1,Johns Hopkins University,4.6,Beginner,4
Preparing for the SAS Programming Certification Exam,SAS,4.8,Intermediate,12
Data Analysis with Tableau,Tableau Learning Partner,4.0,Beginner,4
Deep Learning Applications for Computer Vision,University of Colorado Boulder,4.6,Intermediate,12
Data Analysis with Spreadsheets and SQL,Meta,4.2,Beginner,12
Launching into Machine Learning,Google Cloud,4.6,Beginner,12
Excel Essentials and Beyond,Board Infinity ,4.4733898305084745,Beginner,12
Data Science with R - Capstone Project,IBM,4.5,Intermediate,12
Developing Data Models with LookML,Google Cloud,4.8,Intermediate,4
Python Essentials for MLOps,Duke University,4.2,Intermediate,12
Generative Pre-trained Transformers (GPT),University of Glasgow ,4.5,Intermediate,4
Python Data Analytics,Meta,4.3,Beginner,4
Practical SAS Programming and Certification Review,SAS,4.9,Intermediate,12
Developing AI Policy,Fred Hutchinson Cancer Center,4.4733898305084745,Beginner,4
Hadoop Platform and Application Framework,University of California San Diego,4.0,Mixed,12
Machine Learning Rapid Prototyping with IBM Watson Studio,IBM ,4.3,Intermediate,4
Programming for Data Science,University of Leeds,3.8,Beginner,4
Math behind Moneyball,University of Houston,4.5,Beginner,12
Designing Autonomous AI,University of Washington,4.7,Beginner,4
Security for Artificial Intelligence Software and Services,Board Infinity ,4.4733898305084745,Intermediate,4
Fundamentals of Machine Learning in Finance,New York University,3.8,Intermediate,4
Statistics for Genomic Data Science,Johns Hopkins University,4.2,Mixed,4
Text Mining and Analytics,University of Illinois at Urbana-Champaign,4.5,Mixed,12
Probability and Statistics: To p or not to p?,University of London,4.6,Beginner,12
Applied Text Mining in Python,University of Michigan,4.2,Intermediate,4
Inferential Statistical Analysis with Python,University of Michigan,4.6,Intermediate,4
Linear Regression,Illinois Tech,4.5,Intermediate,4
Structured Query Language (SQL) using SAS,SAS,4.9,Mixed,12
Text Retrieval and Search Engines,University of Illinois at Urbana-Champaign,4.5,Mixed,12
الأسس: البيانات، البيانات في كل مكان,Google,4.7,Beginner,12
Generalized Linear Models and Nonparametric Regression,University of Colorado Boulder,4.4,Intermediate,4
Geospatial Analysis with ArcGIS,"University of California, Davis",4.4,Intermediate,4
MLOps Tools: MLflow and Hugging Face,Duke University,3.5,Advanced,4
Azure Data Lake Storage Gen2 and Data Streaming Solution,Microsoft,4.2,Intermediate,4
Statistical Inference,Johns Hopkins University,4.2,Mixed,4
Creating Dashboards and Storytelling with Tableau,"University of California, Davis",4.6,Beginner,4
Exploratory Data Analysis with MATLAB,MathWorks,4.8,Beginner,12
"Data Science with NumPy, Sets, and Dictionaries",Duke University,4.4733898305084745,Beginner,4
Introduction to Big Data,University of California San Diego,4.6,Mixed,12
Prepare for DP-203: Data Engineering on Microsoft Azure Exam,Microsoft,4.4,Intermediate,4
Communicating Data Insights with Tableau,Tableau Learning Partner,4.1,Beginner,4
Introduction to Deep Learning for Computer Vision,MathWorks,4.4733898305084745,Intermediate,4
Python and Pandas for Data Engineering,Duke University,4.6,Beginner,4
Microsoft Azure Machine Learning for Data Scientists,Microsoft,4.4,Intermediate,4
Big Data Modeling and Management Systems,University of California San Diego,4.4,Mixed,12
Use Generative AI as Your Thought Partner,Coursera ,4.4733898305084745,Beginner,4
"Basic Data Descriptors, Statistical Distributions, and Application to Business Decisions",Rice University,4.7,Mixed,4
Data Warehousing with Microsoft Azure Synapse Analytics,Microsoft,4.0,Intermediate,12
Getting Started with Data Visualization in R,Johns Hopkins University,4.7,Beginner,4
"Introduction to Data, Signal, and Image Analysis with MATLAB",Vanderbilt University,4.7,Intermediate,12
Advanced SAS Programming Techniques,SAS,4.8,Intermediate,12
Statistics in Psychological Research,American Psychological Association,4.6,Beginner,12
Introduction to Statistical Analysis:  Hypothesis Testing,SAS,4.6,Intermediate,4
Mastering Data Analysis in Excel,Duke University,4.2,Mixed,12
Bioconductor for Genomic Data Science,Johns Hopkins University,3.8,Mixed,4
Applied Data Science for Data Analysts,Databricks,4.5,Intermediate,12
Bayesian Statistics: Time Series Analysis,"University of California, Santa Cruz",4.5,Intermediate,12
Python Packages for Data Science,University of Colorado Boulder,4.4,Intermediate,4
Introduction to Microsoft Azure Synapse Analytics,Microsoft,3.9,Intermediate,12
Natural Language Processing in Microsoft Azure,Microsoft,4.7,Beginner,4
Reinforcement Learning in Finance,New York University,3.5,Advanced,4
How Google does Machine Learning,Google Cloud,4.6,Beginner,12
Bayesian Statistics: Mixture Models,"University of California, Santa Cruz",4.6,Intermediate,12
Data Visualization with Tableau Project,"University of California, Davis",4.6,Intermediate,12
Natural Language Processing on Google Cloud,Google Cloud,4.4,Advanced,12
Setting a Generative AI Strategy,Coursera ,5.0,Beginner,4
Introduction to R Programming and Tidyverse,University of Colorado Boulder,4.3,Beginner,4
Regression Models,Johns Hopkins University,4.4,Mixed,4
Data Engineering with MS Azure Synapse Apache Spark Pools,Microsoft,3.7,Intermediate,4
Introduction to Python Functions,University of Colorado Boulder,4.8,Beginner,4
Building Production-Ready Apps with Large Language Models,Coursera Instructor Network,4.4733898305084745,Intermediate,4
"DevOps, DataOps, MLOps",Duke University,3.8,Advanced,12
Reproducible Research,Johns Hopkins University,4.6,Mixed,4
Machine Learning Operations (MLOps): Getting Started,Google Cloud,4.0,Intermediate,4
Data Science in Stratified Healthcare and Precision Medicine,The University of Edinburgh,4.6,Intermediate,12
Operational Analytics with Microsoft Azure Synapse Analytics,Microsoft,4.5,Intermediate,4
Getting Started with CyberGIS,University of Illinois at Urbana-Champaign,4.1,Beginner,12
TensorFlow on Google Cloud,Google Cloud,4.4,Intermediate,12
Preparing for AI-900: Microsoft Azure AI Fundamentals exam,Microsoft,4.7,Beginner,4
Introduction to Data Analytics for Business,University of Colorado Boulder,4.7,Beginner,4
Statistics with SAS,SAS,4.7,Intermediate,12
Introduction to Machine Learning: Supervised Learning,University of Colorado Boulder,3.4,Intermediate,12
SQL for Data Science Capstone Project,"University of California, Davis",4.2,Intermediate,4
Build and Operate Machine Learning Solutions with Azure,Microsoft,4.1,Intermediate,12
Machine Learning: Classification,University of Washington,4.7,Mixed,12
Introduction to Data Analytics for Accounting Professionals,Association of International Certified Professional Accountants,4.7,Beginner,4
Data Analysis and Presentation Skills: the PwC Approach Final Project,PwC,4.7,Beginner,12
Data Science for Business Innovation,EIT Digital ,4.3,Beginner,4
Statistical Learning,Illinois Tech,4.4733898305084745,Intermediate,12
Modern Regression Analysis in R,University of Colorado Boulder,4.5,Intermediate,12
Statistical Inference and Hypothesis Testing in Data Science Applications,University of Colorado Boulder,4.7,Intermediate,12
Solve Business Problems with AI and Machine Learning,CertNexus,4.3,Intermediate,4
"Build AI Apps with ChatGPT, Dall-E, and GPT-4",Scrimba,4.3,Intermediate,4
Code Free Data Science,University of California San Diego,4.3,Beginner,4
MongoDB Aggregation Framework,MongoDB Inc.,4.5,Intermediate,4
Causal Inference,Columbia University,3.1,Advanced,12
Statistical Inference for Estimation in Data Science,University of Colorado Boulder,4.0,Intermediate,12
Building a Data Science Team,Johns Hopkins University,4.5,Mixed,4
Advanced Data Science Capstone,IBM,4.6,Advanced,4
Prediction Models with Sports Data,University of Michigan,4.6,Intermediate,12
Fitting Statistical Models to Data with Python,University of Michigan,4.4,Intermediate,4
Snowflake - SnowPro Core Certification Preparation,Board Infinity ,4.4733898305084745,Intermediate,4
"Statistics and Data Analysis with Excel, Part 2",University of Colorado Boulder,4.4733898305084745,Intermediate,12
Practical Decision-Making Using No-code ML on AWS,Amazon Web Services,4.5,Beginner,4
Data-Driven Animation for Science Communication,"University of California, Santa Cruz",4.8,Intermediate,12
Data Visualization for Genome Biology,University of Toronto,4.4733898305084745,Intermediate,12
